{
  "schema_version": 1,
  "request_id": "request-public-fixture-0001",
  "target": "local_service",
  "action": "plan_complex_task",
  "parameters": {
    "user_text": "organize the synthetic fixture folder"
  },
  "risk": "high",
  "requires_confirmation": true,
  "confirmation_state": "pending",
  "dry_run": true,
  "created_at": "2026-08-10T08:30:00Z",
  "redaction": {
    "public_log_safe": false,
    "sensitive_fields": [
      "parameters.user_text"
    ]
  }
}
